QuestionIDwithQuestionyears,book_chapter,topics,QuestionText,OptionA,OptionB,OptionC,OptionD,answer,Marks,Type
2018-1-31,D2-6,程式測試和除錯,細看以下算法： 輸入 n 如果 n < -6 則 y <- 2 否則 如果 n > 9 則 y <- y - 2 否則 y <- y x 2 下列哪組輸入數據最適合用作測試此算法？,-6, 1, 9,9, 0, 1, 2,-20, -6, 0, 9, 15,-20, -10, 0, 1, 10, 20,C,2,MC
2018-1-32,D1-2,算法設計,細看以下流程圖的一部分：(一個循環，條件為 X >= Y)。假設 X 和 Y 的初始值分別為 14 和 4。輸出是什麼？,0,1,2,3,C,2,MC
2018-1-33,D1-2,布爾邏輯,假設 x = 1、y = 2 和 z = 3。下列哪個布爾算式是「真」？,((X = 1) AND (Y > -2)) AND (Z > 3),((X = 1) AND (Y > 2)) OR (Z > 3),((X = 1) OR (Y > -2)) AND (Z < 3),((X = 1) AND (Y > -2) AND (Z > 3)),B,2,MC
2018-1-34,D1-3,模組化,於設計電腦解決方案時使用模組的特徵是什麼？ (1)模組通常是用來解決簡單的問題。 (2)模組可最是可重用的。 (3)開發成本較高。 (4)模組可以獨立開發。,只有(1)和(3),只有(1)和(4),只有(2)和(3),只有(2)和(4),D,2,MC
2018-1-35,E-2,用戶界面的人機工程學,在軟件設計中從人體工學方面有什麼良好做法？ (1)固定字體大小 (2)給用戶適當的系統信息 (3)一致的用戶界面,只有(1)和(2),只有(1)和(3),只有(2)和(3),(1)、(2)和(3),C,2,MC
2018-1-36,E-3,知識產權,李小姐是一名攝影師。張先生於未經李小姐同意下，從她的網站下載大量版權照片，並在某社交社使用。這很可能引致什麼法律後果？ (1)張先生需要向李小姐作出賠償。 (2)張先生可能要受刑事罪行。 (3)張先生需要刪除他來自的補習社。,只有(1)和(2),只有(1)和(3),只有(2)和(3),(1)、(2)和(3),A,2,MC
2018-1-37,C2-6,網絡保安措施,在互聯網上，為什麼我們需要保密插口層(SSL)？,IP 位址最少包含了四個數值。,可保護電源插口。,數據傳輸速度可更快。,可安全地傳輸數據。,D,2,MC
2018-1-38,C2-6,資料加密技術,在通過互聯網傳輸機密資料時，使用數據加密的主要好處是什麼？ (1)黑客不能輕易收集加密數據 (2)黑客不能輕易讀取機密資料 (3)黑客不能輕易刪除機密資料,只有(1),只有(2),只有(1)和(3),只有(2)和(3),B,2,MC
2018-1-39,E-3,保護知識產權的科技,在互聯網上所發布的照片，有什麼適當措施可保護其知識產權？ (1)數碼簽署 (2)數碼水印 (3)防火牆,只有(1),只有(2),只有(1)和(3),只有(2)和(3),B,2,MC
2018-1-40,C2-6,認證方法,在電腦系統的認證中，使用指紋比較使用密碼有何好處？ (1)一般來說，輸入時間較短。 (2)系統開發的成本更低。 (3)用潔淨手指可減少錯誤。,只有(1),只有(2),只有(1)和(3),只有(2)和(3),B,2,MC
